{
  "decision": "The protocol step requires adding 0.1 mL (100 µL) buffer to the sample tube. The initial lab state shows the sample tube and buffer are in the fridge, which is closed. The expected lab state requires the fridge closed and items returned. To execute, we need to open the fridge, pick the buffer and sample tube, uncap the sample tube, attach a pipette tip, transfer buffer, cap the tube, place items back, close the fridge, and discard the tip. All required APIs are available in available_apis, so no unregistered APIs are needed.",
  "reasoning_summary": "The step involves adding buffer to a sample tube. The workflow must handle retrieving items from the fridge, performing the transfer, and restoring the lab to the expected state (fridge closed, items returned). All necessary actions (open/close fridge, pick/place, uncap/cap, pipette operations) are covered by registered APIs. The volume transfer matches pipette.transfer parameters. After execution, the lab state will match the expected state by returning items and closing the fridge.",
  "workflow": {
    "api_calls": [
      {
        "call_id": "c1",
        "api": "fridge.open",
        "args": {},
        "source_step_id": "s1"
      },
      {
        "call_id": "c2",
        "api": "robot.pick",
        "args": {
          "item": "buffer",
          "from_location": "fridge"
        },
        "source_step_id": "s1"
      },
      {
        "call_id": "c3",
        "api": "robot.place",
        "args": {
          "item": "buffer",
          "to_location": "bench"
        },
        "source_step_id": "s1"
      },
      {
        "call_id": "c4",
        "api": "robot.pick",
        "args": {
          "item": "sample_tube",
          "from_location": "fridge"
        },
        "source_step_id": "s1"
      },
      {
        "call_id": "c5",
        "api": "robot.place",
        "args": {
          "item": "sample_tube",
          "to_location": "bench"
        },
        "source_step_id": "s1"
      },
      {
        "call_id": "c6",
        "api": "tube.uncap",
        "args": {
          "tube_id": "sample_tube"
        },
        "source_step_id": "s1"
      },
      {
        "call_id": "c7",
        "api": "pipette.attach_tip",
        "args": {},
        "source_step_id": "s1"
      },
      {
        "call_id": "c8",
        "api": "pipette.transfer",
        "args": {
          "source": "buffer",
          "target": "sample_tube",
          "volume_ul": 100.0
        },
        "source_step_id": "s1"
      },
      {
        "call_id": "c9",
        "api": "tube.cap",
        "args": {
          "tube_id": "sample_tube"
        },
        "source_step_id": "s1"
      },
      {
        "call_id": "c10",
        "api": "robot.pick",
        "args": {
          "item": "sample_tube",
          "from_location": "bench"
        },
        "source_step_id": "s1"
      },
      {
        "call_id": "c11",
        "api": "robot.place",
        "args": {
          "item": "sample_tube",
          "to_location": "fridge"
        },
        "source_step_id": "s1"
      },
      {
        "call_id": "c12",
        "api": "robot.pick",
        "args": {
          "item": "buffer",
          "from_location": "bench"
        },
        "source_step_id": "s1"
      },
      {
        "call_id": "c13",
        "api": "robot.place",
        "args": {
          "item": "buffer",
          "to_location": "fridge"
        },
        "source_step_id": "s1"
      },
      {
        "call_id": "c14",
        "api": "fridge.close",
        "args": {},
        "source_step_id": "s1"
      },
      {
        "call_id": "c15",
        "api": "pipette.discard_tip",
        "args": {},
        "source_step_id": "s1"
      }
    ]
  },
  "contains_unregistered_api": false,
  "unregistered_apis": [],
  "assumptions": [
    "The buffer container is accessible for pipetting from the bench after being placed there. The sample tube contents are updated implicitly after transfer. The pipette tip is attached once and discarded after use. The fridge.open and fridge.close do not require parameters. The robot.pick/place locations are specified as strings matching lab state items."
  ]
}