{
  "decision": "Convert protocol steps to API calls using available_apis, ensuring lab state returns to expected.",
  "reasoning_summary": "The protocol involves taking a sample tube from the fridge, adding lysis buffer, mixing, and incubating. Available APIs can handle most steps: robot.pick/place for moving tube, pipette.transfer for adding buffer, pipette.mix for mixing, and heater.set_temperature/place/timer.wait/remove for incubation. However, the 'tube.uncap' and 'tube.cap' APIs are available for capping operations, but the protocol does not explicitly specify uncapping/capping; we assume it's needed for adding buffer and mixing, so we include uncap before transfer and cap after incubation to restore capped state. The initial and expected lab states are identical, so we must return all items to the fridge and ensure heater is empty and temperature null. All APIs used are registered, so no unregistered APIs are needed.",
  "workflow": {
    "api_calls": [
      {
        "call_id": "c1",
        "api": "fridge.open",
        "args": {},
        "source_step_id": "s1"
      },
      {
        "call_id": "c2",
        "api": "robot.pick",
        "args": {
          "item": "sample_tube",
          "from_location": "fridge"
        },
        "source_step_id": "s1"
      },
      {
        "call_id": "c3",
        "api": "robot.place",
        "args": {
          "item": "sample_tube",
          "to_location": "bench"
        },
        "source_step_id": "s1"
      },
      {
        "call_id": "c4",
        "api": "fridge.close",
        "args": {},
        "source_step_id": "s1"
      },
      {
        "call_id": "c5",
        "api": "tube.uncap",
        "args": {
          "tube_id": "sample_tube"
        },
        "source_step_id": "s2"
      },
      {
        "call_id": "c6",
        "api": "pipette.attach_tip",
        "args": {},
        "source_step_id": "s2"
      },
      {
        "call_id": "c7",
        "api": "pipette.transfer",
        "args": {
          "source": "lysis_buffer",
          "target": "sample_tube",
          "volume_ul": 100
        },
        "source_step_id": "s2"
      },
      {
        "call_id": "c8",
        "api": "pipette.discard_tip",
        "args": {},
        "source_step_id": "s2"
      },
      {
        "call_id": "c9",
        "api": "pipette.attach_tip",
        "args": {},
        "source_step_id": "s3"
      },
      {
        "call_id": "c10",
        "api": "pipette.mix",
        "args": {
          "container": "sample_tube",
          "volume_ul": 100,
          "times": 5
        },
        "source_step_id": "s3"
      },
      {
        "call_id": "c11",
        "api": "pipette.discard_tip",
        "args": {},
        "source_step_id": "s3"
      },
      {
        "call_id": "c12",
        "api": "heater.set_temperature",
        "args": {
          "temperature_c": 37
        },
        "source_step_id": "s4"
      },
      {
        "call_id": "c13",
        "api": "heater.place",
        "args": {
          "item": "sample_tube"
        },
        "source_step_id": "s4"
      },
      {
        "call_id": "c14",
        "api": "timer.wait",
        "args": {
          "minutes": 10
        },
        "source_step_id": "s4"
      },
      {
        "call_id": "c15",
        "api": "heater.remove",
        "args": {
          "item": "sample_tube"
        },
        "source_step_id": "s4"
      },
      {
        "call_id": "c16",
        "api": "tube.cap",
        "args": {
          "tube_id": "sample_tube"
        },
        "source_step_id": "s4"
      },
      {
        "call_id": "c17",
        "api": "fridge.open",
        "args": {},
        "source_step_id": null
      },
      {
        "call_id": "c18",
        "api": "robot.pick",
        "args": {
          "item": "sample_tube",
          "from_location": "bench"
        },
        "source_step_id": null
      },
      {
        "call_id": "c19",
        "api": "robot.place",
        "args": {
          "item": "sample_tube",
          "to_location": "fridge"
        },
        "source_step_id": null
      },
      {
        "call_id": "c20",
        "api": "fridge.close",
        "args": {},
        "source_step_id": null
      },
      {
        "call_id": "c21",
        "api": "heater.set_temperature",
        "args": {
          "temperature_c": null
        },
        "source_step_id": null
      }
    ]
  },
  "contains_unregistered_api": false,
  "unregistered_apis": [],
  "assumptions": [
    "The sample tube is identified as 'sample_tube' in lab state, and lysis buffer as 'lysis_buffer'. We assume uncapping is required before adding buffer and mixing, and capping is restored after incubation to match expected capped state. The heater temperature is set to null after use to match expected state. All items are returned to fridge to restore initial/expected state."
  ]
}