{
  "decision": "Convert parsed protocol steps to API workflow calls using available_apis.",
  "reasoning_summary": "The protocol involves taking a sample tube from the fridge, adding lysis buffer, mixing, and incubating. Available APIs can handle most steps: robot.pick/place for moving the tube, pipette.transfer for adding buffer, pipette.mix for mixing, and heater.set_temperature/place/timer.wait for incubation. However, the 'take' action from the fridge requires opening the fridge first, which is supported by fridge.open/close. All APIs needed are registered, so no unregistered APIs are required. The lab state must be restored to initial/expected state after the experiment, which involves returning the tube to the fridge and ensuring the heater is empty and temperature reset.",
  "workflow": {
    "api_calls": [
      {
        "call_id": "c1",
        "api": "fridge.open",
        "args": {},
        "source_step_id": "s1"
      },
      {
        "call_id": "c2",
        "api": "robot.pick",
        "args": {
          "item": "sample_tube",
          "from_location": "fridge"
        },
        "source_step_id": "s1"
      },
      {
        "call_id": "c3",
        "api": "fridge.close",
        "args": {},
        "source_step_id": "s1"
      },
      {
        "call_id": "c4",
        "api": "robot.place",
        "args": {
          "item": "sample_tube",
          "to_location": "bench"
        },
        "source_step_id": "s1"
      },
      {
        "call_id": "c5",
        "api": "tube.uncap",
        "args": {
          "tube_id": "sample_tube"
        },
        "source_step_id": "s2"
      },
      {
        "call_id": "c6",
        "api": "pipette.attach_tip",
        "args": {},
        "source_step_id": "s2"
      },
      {
        "call_id": "c7",
        "api": "pipette.transfer",
        "args": {
          "source": "lysis_buffer",
          "target": "sample_tube",
          "volume_ul": 100
        },
        "source_step_id": "s2"
      },
      {
        "call_id": "c8",
        "api": "pipette.discard_tip",
        "args": {},
        "source_step_id": "s2"
      },
      {
        "call_id": "c9",
        "api": "pipette.attach_tip",
        "args": {},
        "source_step_id": "s3"
      },
      {
        "call_id": "c10",
        "api": "pipette.mix",
        "args": {
          "container": "sample_tube",
          "volume_ul": 100,
          "times": 5
        },
        "source_step_id": "s3"
      },
      {
        "call_id": "c11",
        "api": "pipette.discard_tip",
        "args": {},
        "source_step_id": "s3"
      },
      {
        "call_id": "c12",
        "api": "tube.cap",
        "args": {
          "tube_id": "sample_tube"
        },
        "source_step_id": "s4"
      },
      {
        "call_id": "c13",
        "api": "heater.set_temperature",
        "args": {
          "temperature_c": 37
        },
        "source_step_id": "s4"
      },
      {
        "call_id": "c14",
        "api": "heater.place",
        "args": {
          "item": "sample_tube"
        },
        "source_step_id": "s4"
      },
      {
        "call_id": "c15",
        "api": "timer.wait",
        "args": {
          "minutes": 10
        },
        "source_step_id": "s4"
      },
      {
        "call_id": "c16",
        "api": "heater.remove",
        "args": {
          "item": "sample_tube"
        },
        "source_step_id": "s4"
      },
      {
        "call_id": "c17",
        "api": "heater.set_temperature",
        "args": {
          "temperature_c": null
        },
        "source_step_id": "s4"
      },
      {
        "call_id": "c18",
        "api": "fridge.open",
        "args": {},
        "source_step_id": "s1"
      },
      {
        "call_id": "c19",
        "api": "robot.pick",
        "args": {
          "item": "sample_tube",
          "from_location": "bench"
        },
        "source_step_id": "s1"
      },
      {
        "call_id": "c20",
        "api": "robot.place",
        "args": {
          "item": "sample_tube",
          "to_location": "fridge"
        },
        "source_step_id": "s1"
      },
      {
        "call_id": "c21",
        "api": "fridge.close",
        "args": {},
        "source_step_id": "s1"
      }
    ]
  },
  "contains_unregistered_api": false,
  "unregistered_apis": [],
  "assumptions": [
    "The sample tube is identified as 'sample_tube' in lab_state_initial.",
    "The lysis buffer is identified as 'lysis_buffer' in lab_state_initial.",
    "The bench is a valid location for robot.place.",
    "The pipette.mix volume is assumed to be 100 uL based on typical protocols, as not specified in step s3.",
    "After incubation, the tube must be returned to the fridge to match the expected lab state, and the heater temperature must be reset to null."
  ]
}