{
  "decision": "Convert parsed protocol steps to API workflow calls using available APIs where possible, ensuring lab state matches expected state.",
  "reasoning_summary": "The protocol involves simple steps: open fridge, take sample tube, add buffer, mix, cap, return to fridge. Available APIs can handle most actions: fridge.open, robot.pick/place for taking/returning, tube.cap for capping, pipette.transfer for adding buffer, pipette.mix for mixing. However, the 'take' and 'return' actions require robot.pick and robot.place, which are registered. The initial lab state shows sample_tube in fridge, capped, and expected state is identical after experiment. Need to ensure fridge is closed at end (fridge.close) to match expected is_open: false, as fridge.open will open it. Also, pipette operations require tip handling (attach_tip, discard_tip) for transfer and mix, which are available. All APIs needed are in available_apis, so no unregistered APIs.",
  "workflow": {
    "api_calls": [
      {
        "call_id": "c1",
        "api": "fridge.open",
        "args": {},
        "source_step_id": "s1"
      },
      {
        "call_id": "c2",
        "api": "robot.pick",
        "args": {
          "item": "sample_tube",
          "from_location": "fridge"
        },
        "source_step_id": "s2"
      },
      {
        "call_id": "c3",
        "api": "pipette.attach_tip",
        "args": {},
        "source_step_id": null
      },
      {
        "call_id": "c4",
        "api": "pipette.transfer",
        "args": {
          "source": "buffer",
          "target": "sample_tube",
          "volume_ul": 100
        },
        "source_step_id": "s3"
      },
      {
        "call_id": "c5",
        "api": "pipette.mix",
        "args": {
          "container": "sample_tube",
          "volume_ul": 100,
          "times": 5
        },
        "source_step_id": "s4"
      },
      {
        "call_id": "c6",
        "api": "pipette.discard_tip",
        "args": {},
        "source_step_id": null
      },
      {
        "call_id": "c7",
        "api": "tube.cap",
        "args": {
          "tube_id": "sample_tube"
        },
        "source_step_id": "s5"
      },
      {
        "call_id": "c8",
        "api": "robot.place",
        "args": {
          "item": "sample_tube",
          "to_location": "fridge"
        },
        "source_step_id": "s6"
      },
      {
        "call_id": "c9",
        "api": "fridge.close",
        "args": {},
        "source_step_id": null
      }
    ]
  },
  "contains_unregistered_api": false,
  "unregistered_apis": [],
  "assumptions": [
    "Sample tube is identified as 'sample_tube' from lab state.",
    "Buffer reagent is identified as 'buffer' from lab state.",
    "Pipette operations assume default tip attachment and discard for cleanliness.",
    "Fridge.close is added to ensure lab state matches expected is_open: false, as protocol does not explicitly close fridge but expected state requires it closed."
  ]
}