{
  "decision": "The protocol involves taking a sample tube from the fridge, adding lysis buffer, and incubating. The expected lab state is identical to the initial state, meaning all items must be returned to the fridge and the heater must be empty. The available APIs support these actions, but we need to simulate incubation using heater and timer APIs. All required APIs are registered.",
  "reasoning_summary": "We need to: 1) Open fridge, pick sample tube, place on bench, close fridge. 2) Uncap tube, attach pipette tip, transfer lysis buffer from fridge (source) to tube, discard tip, cap tube. 3) Set heater temperature, place tube in heater, wait, remove tube. 4) Return tube to fridge to match expected state. All APIs used are in available_apis list.",
  "workflow": {
    "api_calls": [
      {
        "call_id": "c1",
        "api": "fridge.open",
        "args": {},
        "source_step_id": "s1"
      },
      {
        "call_id": "c2",
        "api": "robot.pick",
        "args": {
          "item": "sample_tube",
          "from_location": "fridge"
        },
        "source_step_id": "s1"
      },
      {
        "call_id": "c3",
        "api": "robot.place",
        "args": {
          "item": "sample_tube",
          "to_location": "bench"
        },
        "source_step_id": "s1"
      },
      {
        "call_id": "c4",
        "api": "fridge.close",
        "args": {},
        "source_step_id": "s1"
      },
      {
        "call_id": "c5",
        "api": "tube.uncap",
        "args": {
          "tube_id": "sample_tube"
        },
        "source_step_id": "s2"
      },
      {
        "call_id": "c6",
        "api": "pipette.attach_tip",
        "args": {},
        "source_step_id": "s2"
      },
      {
        "call_id": "c7",
        "api": "pipette.transfer",
        "args": {
          "source": "lysis_buffer",
          "target": "sample_tube",
          "volume_ul": 50
        },
        "source_step_id": "s2"
      },
      {
        "call_id": "c8",
        "api": "pipette.discard_tip",
        "args": {},
        "source_step_id": "s2"
      },
      {
        "call_id": "c9",
        "api": "tube.cap",
        "args": {
          "tube_id": "sample_tube"
        },
        "source_step_id": "s2"
      },
      {
        "call_id": "c10",
        "api": "heater.set_temperature",
        "args": {
          "temperature_c": 37
        },
        "source_step_id": "s3"
      },
      {
        "call_id": "c11",
        "api": "heater.place",
        "args": {
          "item": "sample_tube"
        },
        "source_step_id": "s3"
      },
      {
        "call_id": "c12",
        "api": "timer.wait",
        "args": {
          "minutes": 10
        },
        "source_step_id": "s3"
      },
      {
        "call_id": "c13",
        "api": "heater.remove",
        "args": {
          "item": "sample_tube"
        },
        "source_step_id": "s3"
      },
      {
        "call_id": "c14",
        "api": "robot.pick",
        "args": {
          "item": "sample_tube",
          "from_location": "bench"
        },
        "source_step_id": null
      },
      {
        "call_id": "c15",
        "api": "robot.place",
        "args": {
          "item": "sample_tube",
          "to_location": "fridge"
        },
        "source_step_id": null
      }
    ]
  },
  "contains_unregistered_api": false,
  "unregistered_apis": [],
  "assumptions": [
    "The sample tube ID is 'sample_tube', lysis buffer reagent ID is 'lysis_buffer', and bench is a valid location for robot.place. After incubation, we return the tube to the fridge to match expected state where sample_tube location is fridge."
  ]
}