{
  "decision": "Proceed with workflow generation, but centrifuge step requires unregistered API.",
  "reasoning_summary": "The protocol has three steps: take sample tube from fridge, briefly centrifuge, then add buffer and incubate. Available APIs cover taking tube (via robot.pick), adding buffer (via pipette.transfer), and incubating (via heater.set_temperature, heater.place, timer.wait, heater.remove). However, there is no centrifuge API in available_apis. According to rules, I must create a placeholder API call for centrifuge and set contains_unregistered_api=true. The lab_state_initial and lab_state_expected are identical, so after performing the experiment, I must restore the lab to initial state (e.g., return tube to fridge, close fridge, etc.).",
  "workflow": {
    "api_calls": [
      {
        "call_id": "c1",
        "api": "fridge.open",
        "args": {},
        "source_step_id": "s1"
      },
      {
        "call_id": "c2",
        "api": "robot.pick",
        "args": {
          "item": "sample_tube",
          "from_location": "fridge"
        },
        "source_step_id": "s1"
      },
      {
        "call_id": "c3",
        "api": "fridge.close",
        "args": {},
        "source_step_id": "s1"
      },
      {
        "call_id": "c4",
        "api": "tube.uncap",
        "args": {
          "tube_id": "sample_tube"
        },
        "source_step_id": "s2"
      },
      {
        "call_id": "c5",
        "api": "centrifuge.brief_spin",
        "args": {
          "tube_id": "sample_tube"
        },
        "source_step_id": "s2"
      },
      {
        "call_id": "c6",
        "api": "tube.cap",
        "args": {
          "tube_id": "sample_tube"
        },
        "source_step_id": "s2"
      },
      {
        "call_id": "c7",
        "api": "pipette.attach_tip",
        "args": {},
        "source_step_id": "s3"
      },
      {
        "call_id": "c8",
        "api": "pipette.transfer",
        "args": {
          "source": "buffer",
          "target": "sample_tube",
          "volume_ul": 100
        },
        "source_step_id": "s3"
      },
      {
        "call_id": "c9",
        "api": "pipette.discard_tip",
        "args": {},
        "source_step_id": "s3"
      },
      {
        "call_id": "c10",
        "api": "heater.set_temperature",
        "args": {
          "temperature_c": 37
        },
        "source_step_id": "s3"
      },
      {
        "call_id": "c11",
        "api": "heater.place",
        "args": {
          "item": "sample_tube"
        },
        "source_step_id": "s3"
      },
      {
        "call_id": "c12",
        "api": "timer.wait",
        "args": {
          "minutes": 10
        },
        "source_step_id": "s3"
      },
      {
        "call_id": "c13",
        "api": "heater.remove",
        "args": {
          "item": "sample_tube"
        },
        "source_step_id": "s3"
      },
      {
        "call_id": "c14",
        "api": "fridge.open",
        "args": {},
        "source_step_id": null
      },
      {
        "call_id": "c15",
        "api": "robot.place",
        "args": {
          "item": "sample_tube",
          "to_location": "fridge"
        },
        "source_step_id": null
      },
      {
        "call_id": "c16",
        "api": "fridge.close",
        "args": {},
        "source_step_id": null
      }
    ]
  },
  "contains_unregistered_api": true,
  "unregistered_apis": [
    "centrifuge.brief_spin"
  ],
  "assumptions": [
    "The sample tube is identified as 'sample_tube' in lab_state. The buffer reagent is identified as 'buffer'. The centrifuge step is brief and does not require specific parameters like speed; a placeholder API 'centrifuge.brief_spin' is used. After incubation, the tube is returned to fridge to match expected lab state."
  ]
}