{
  "decision": "The protocol step requires adding 100 uL buffer to the sample tube. The available APIs include pipette.transfer, which can handle this action. However, the initial lab state shows the sample tube and buffer are in the fridge, which is closed, and the pipette has no tip. To perform the transfer, we need to open the fridge, pick the sample tube and buffer, uncap the sample tube, attach a tip, transfer, discard the tip, cap the sample tube, place items back, and close the fridge. After completing the transfer, the lab state must match the expected state: fridge closed with all items inside, pipette without tip, and tubes capped. The workflow includes only registered APIs, so no unregistered APIs are needed.",
  "reasoning_summary": "The protocol step involves a simple liquid transfer. The workflow is designed to use available APIs to execute the transfer while respecting initial and expected lab states. All required APIs (fridge.open, robot.pick, tube.uncap, pipette.attach_tip, pipette.transfer, pipette.discard_tip, tube.cap, robot.place, fridge.close) are registered in available_apis, ensuring no unregistered APIs are used. The workflow restores the lab to the expected state by returning items to the fridge and ensuring the fridge is closed and pipette tip is discarded.",
  "workflow": {
    "api_calls": [
      {
        "call_id": "c1",
        "api": "fridge.open",
        "args": {},
        "source_step_id": "s1"
      },
      {
        "call_id": "c2",
        "api": "robot.pick",
        "args": {
          "item": "sample_tube",
          "from_location": "fridge"
        },
        "source_step_id": "s1"
      },
      {
        "call_id": "c3",
        "api": "robot.pick",
        "args": {
          "item": "buffer",
          "from_location": "fridge"
        },
        "source_step_id": "s1"
      },
      {
        "call_id": "c4",
        "api": "tube.uncap",
        "args": {
          "tube_id": "sample_tube"
        },
        "source_step_id": "s1"
      },
      {
        "call_id": "c5",
        "api": "pipette.attach_tip",
        "args": {},
        "source_step_id": "s1"
      },
      {
        "call_id": "c6",
        "api": "pipette.transfer",
        "args": {
          "source": "buffer",
          "target": "sample_tube",
          "volume_ul": 100
        },
        "source_step_id": "s1"
      },
      {
        "call_id": "c7",
        "api": "pipette.discard_tip",
        "args": {},
        "source_step_id": "s1"
      },
      {
        "call_id": "c8",
        "api": "tube.cap",
        "args": {
          "tube_id": "sample_tube"
        },
        "source_step_id": "s1"
      },
      {
        "call_id": "c9",
        "api": "robot.place",
        "args": {
          "item": "sample_tube",
          "to_location": "fridge"
        },
        "source_step_id": "s1"
      },
      {
        "call_id": "c10",
        "api": "robot.place",
        "args": {
          "item": "buffer",
          "to_location": "fridge"
        },
        "source_step_id": "s1"
      },
      {
        "call_id": "c11",
        "api": "fridge.close",
        "args": {},
        "source_step_id": "s1"
      }
    ]
  },
  "contains_unregistered_api": false,
  "unregistered_apis": [],
  "assumptions": [
    "The buffer is a reagent container that can be used as a source for pipette.transfer without additional handling (e.g., uncapping).",
    "The sample tube is initially capped and must be recapped after transfer.",
    "The robot.pick and robot.place APIs are used to move items between fridge and bench, though the bench location is implicit in the workflow."
  ]
}