{
  "decision": "The protocol step requires centrifugation, but no centrifuge API is available in the provided list. According to the rules, I must create a placeholder API call for the centrifuge action and mark it as unregistered. Since the initial and expected lab states are identical, no additional API calls are needed to restore the lab state after the experiment.",
  "reasoning_summary": "The parsed protocol has one step: centrifuge the sample at 12000 g for 5 minutes. The available_apis list does not include any centrifuge-related APIs (e.g., 'centrifuge.run' or similar). Therefore, I must create a placeholder API call for this action and report it as unregistered. The lab_state_initial and lab_state_expected are the same, indicating no changes to the lab state are required after the experiment, so no additional API calls are needed to restore the state.",
  "workflow": {
    "api_calls": [
      {
        "call_id": "c1",
        "api": "centrifuge.run",
        "args": {
          "target": "sample",
          "speed_g": 12000,
          "duration_min": 5
        },
        "source_step_id": "s1"
      }
    ]
  },
  "contains_unregistered_api": true,
  "unregistered_apis": [
    "centrifuge.run"
  ],
  "assumptions": [
    "The 'sample' entity refers to the 'sample_tube' in the lab state, which contains the sample. The centrifuge operation is performed on this tube, but since no centrifuge API is available, it is simulated as a placeholder."
  ]
}