{
  "decision": "Convert parsed protocol steps to API workflow using available_apis, ensuring lab state returns to expected.",
  "reasoning_summary": "The protocol involves retrieving a sample tube from the fridge, adding buffer, mixing, and incubating. Available APIs cover fridge access, robot manipulation, pipetting, and heating. The initial and expected lab states are identical, so after performing the experiment, we must return the tube to the fridge and ensure all equipment is reset. All required APIs are registered, so no unregistered APIs are needed.",
  "workflow": {
    "api_calls": [
      {
        "call_id": "c1",
        "api": "fridge.open",
        "args": {},
        "source_step_id": "s1"
      },
      {
        "call_id": "c2",
        "api": "robot.pick",
        "args": {
          "item": "sample_tube",
          "from_location": "fridge"
        },
        "source_step_id": "s1"
      },
      {
        "call_id": "c3",
        "api": "robot.place",
        "args": {
          "item": "sample_tube",
          "to_location": "bench"
        },
        "source_step_id": "s1"
      },
      {
        "call_id": "c4",
        "api": "fridge.close",
        "args": {},
        "source_step_id": "s1"
      },
      {
        "call_id": "c5",
        "api": "tube.uncap",
        "args": {
          "tube_id": "sample_tube"
        },
        "source_step_id": "s2"
      },
      {
        "call_id": "c6",
        "api": "pipette.attach_tip",
        "args": {},
        "source_step_id": "s2"
      },
      {
        "call_id": "c7",
        "api": "pipette.transfer",
        "args": {
          "source": "buffer",
          "target": "sample_tube",
          "volume_ul": 100
        },
        "source_step_id": "s2"
      },
      {
        "call_id": "c8",
        "api": "pipette.discard_tip",
        "args": {},
        "source_step_id": "s2"
      },
      {
        "call_id": "c9",
        "api": "pipette.attach_tip",
        "args": {},
        "source_step_id": "s3"
      },
      {
        "call_id": "c10",
        "api": "pipette.mix",
        "args": {
          "container": "sample_tube",
          "volume_ul": 100,
          "times": 5
        },
        "source_step_id": "s3"
      },
      {
        "call_id": "c11",
        "api": "pipette.discard_tip",
        "args": {},
        "source_step_id": "s3"
      },
      {
        "call_id": "c12",
        "api": "tube.cap",
        "args": {
          "tube_id": "sample_tube"
        },
        "source_step_id": "s4"
      },
      {
        "call_id": "c13",
        "api": "heater.set_temperature",
        "args": {
          "temperature_c": 37
        },
        "source_step_id": "s4"
      },
      {
        "call_id": "c14",
        "api": "heater.place",
        "args": {
          "item": "sample_tube"
        },
        "source_step_id": "s4"
      },
      {
        "call_id": "c15",
        "api": "timer.wait",
        "args": {
          "minutes": 10
        },
        "source_step_id": "s4"
      },
      {
        "call_id": "c16",
        "api": "heater.remove",
        "args": {
          "item": "sample_tube"
        },
        "source_step_id": "s4"
      },
      {
        "call_id": "c17",
        "api": "fridge.open",
        "args": {},
        "source_step_id": null
      },
      {
        "call_id": "c18",
        "api": "robot.pick",
        "args": {
          "item": "sample_tube",
          "from_location": "bench"
        },
        "source_step_id": null
      },
      {
        "call_id": "c19",
        "api": "robot.place",
        "args": {
          "item": "sample_tube",
          "to_location": "fridge"
        },
        "source_step_id": null
      },
      {
        "call_id": "c20",
        "api": "fridge.close",
        "args": {},
        "source_step_id": null
      }
    ]
  },
  "contains_unregistered_api": false,
  "unregistered_apis": [],
  "assumptions": [
    "The sample tube is identified as 'sample_tube' in the lab state.",
    "Buffer reagent is identified as 'buffer' in the lab state.",
    "The bench is a valid location for robot.place.",
    "Heater.set_temperature sets the heater to 37°C and maintains it during incubation.",
    "After incubation, the tube is returned to the fridge to match the expected lab state."
  ]
}