{
  "decision": "The protocol step requires centrifugation, but no centrifuge API is available in the provided list. According to the rules, I must create a placeholder for the unsupported operation and set contains_unregistered_api to true.",
  "reasoning_summary": "The parsed protocol step 's1' involves centrifuging a sample at 12000 g for 5 minutes. The available_apis list does not include any centrifuge-related APIs (e.g., 'centrifuge.run'). Therefore, I must treat this as an unregistered API. I will create a placeholder API call with a made-up name 'centrifuge.run' to represent the step. Since the initial and expected lab states are identical, no additional API calls are needed to restore the lab state after the experiment.",
  "workflow": {
    "api_calls": [
      {
        "call_id": "c1",
        "api": "centrifuge.run",
        "args": {
          "target": "sample",
          "speed_g": 12000,
          "duration_min": 5
        },
        "source_step_id": "s1"
      }
    ]
  },
  "contains_unregistered_api": true,
  "unregistered_apis": [
    "centrifuge.run"
  ],
  "assumptions": [
    "The 'sample' refers to the 'sample_tube' in the lab state, which is initially in the fridge and capped. The centrifugation step is performed, but since no centrifuge API exists, it is simulated as an unregistered operation. The lab state remains unchanged as per the expected state."
  ]
}