{
  "decision": "Convert parsed protocol steps to API workflow calls using available_apis.",
  "reasoning_summary": "The protocol involves taking a sample tube from the fridge, adding lysis buffer, mixing, and incubating. Available APIs can handle most steps: robot.pick/place for moving the tube, pipette.transfer for adding buffer, pipette.mix for mixing, and heater.set_temperature/place/timer.wait for incubation. However, the 'take' action from the fridge requires opening the fridge, which is supported by fridge.open/close APIs. The initial and expected lab states are identical, so after the experiment, the tube must be returned to the fridge and the fridge closed. All required APIs are registered in available_apis, so no unregistered APIs are needed.",
  "workflow": {
    "api_calls": [
      {
        "call_id": "c1",
        "api": "fridge.open",
        "args": {},
        "source_step_id": "s1"
      },
      {
        "call_id": "c2",
        "api": "robot.pick",
        "args": {
          "item": "sample_tube",
          "from_location": "fridge"
        },
        "source_step_id": "s1"
      },
      {
        "call_id": "c3",
        "api": "robot.place",
        "args": {
          "item": "sample_tube",
          "to_location": "bench"
        },
        "source_step_id": "s1"
      },
      {
        "call_id": "c4",
        "api": "fridge.close",
        "args": {},
        "source_step_id": "s1"
      },
      {
        "call_id": "c5",
        "api": "tube.uncap",
        "args": {
          "tube_id": "sample_tube"
        },
        "source_step_id": "s2"
      },
      {
        "call_id": "c6",
        "api": "pipette.attach_tip",
        "args": {},
        "source_step_id": "s2"
      },
      {
        "call_id": "c7",
        "api": "pipette.transfer",
        "args": {
          "source": "lysis_buffer",
          "target": "sample_tube",
          "volume_ul": 100
        },
        "source_step_id": "s2"
      },
      {
        "call_id": "c8",
        "api": "pipette.discard_tip",
        "args": {},
        "source_step_id": "s2"
      },
      {
        "call_id": "c9",
        "api": "pipette.attach_tip",
        "args": {},
        "source_step_id": "s3"
      },
      {
        "call_id": "c10",
        "api": "pipette.mix",
        "args": {
          "container": "sample_tube",
          "volume_ul": 100,
          "times": 5
        },
        "source_step_id": "s3"
      },
      {
        "call_id": "c11",
        "api": "pipette.discard_tip",
        "args": {},
        "source_step_id": "s3"
      },
      {
        "call_id": "c12",
        "api": "tube.cap",
        "args": {
          "tube_id": "sample_tube"
        },
        "source_step_id": "s4"
      },
      {
        "call_id": "c13",
        "api": "heater.set_temperature",
        "args": {
          "temperature_c": 37
        },
        "source_step_id": "s4"
      },
      {
        "call_id": "c14",
        "api": "heater.place",
        "args": {
          "item": "sample_tube"
        },
        "source_step_id": "s4"
      },
      {
        "call_id": "c15",
        "api": "timer.wait",
        "args": {
          "minutes": 10
        },
        "source_step_id": "s4"
      },
      {
        "call_id": "c16",
        "api": "heater.remove",
        "args": {
          "item": "sample_tube"
        },
        "source_step_id": "s4"
      },
      {
        "call_id": "c17",
        "api": "fridge.open",
        "args": {},
        "source_step_id": null
      },
      {
        "call_id": "c18",
        "api": "robot.pick",
        "args": {
          "item": "sample_tube",
          "from_location": "bench"
        },
        "source_step_id": null
      },
      {
        "call_id": "c19",
        "api": "robot.place",
        "args": {
          "item": "sample_tube",
          "to_location": "fridge"
        },
        "source_step_id": null
      },
      {
        "call_id": "c20",
        "api": "fridge.close",
        "args": {},
        "source_step_id": null
      }
    ]
  },
  "contains_unregistered_api": false,
  "unregistered_apis": [],
  "assumptions": [
    "The sample tube is identified as 'sample_tube' in the lab state, and lysis buffer as 'lysis_buffer'. The bench is a valid location for robot.place. The pipette.mix volume is assumed to be 100 µL (same as transfer volume) for effective mixing. After incubation, the tube is returned to the fridge to match the expected lab state, requiring additional API calls not directly in the protocol steps."
  ]
}