{
  "decision": "Convert protocol steps to API calls using available_apis where possible, but note that 'incubate' step requires an incubation-specific API not present in available_apis, so an unregistered API must be used.",
  "reasoning_summary": "The protocol involves retrieving a sample tube from the fridge, placing it on the bench, adding lysis buffer, capping, incubating at 37°C for 10 minutes, and storing it back in the fridge. Available APIs cover most actions: robot.pick/place for moving items, pipette.transfer for adding reagent, tube.cap for capping, and fridge.open/close for accessing fridge. However, the incubation step requires an API like 'incubator.incubate' or similar, which is not in available_apis (available_apis only has heater-related calls like heater.set_temperature, heater.place, timer.wait, but no direct incubation API that combines temperature and duration). Therefore, an unregistered API must be introduced for incubation. The initial and expected lab states are identical, so after completing the experiment, the lab must be restored to that state, which involves returning the tube to the fridge and ensuring fridge is closed.",
  "workflow": {
    "api_calls": [
      {
        "call_id": "c1",
        "api": "fridge.open",
        "args": {},
        "source_step_id": "s1"
      },
      {
        "call_id": "c2",
        "api": "robot.pick",
        "args": {
          "item": "sample_tube",
          "from_location": "fridge"
        },
        "source_step_id": "s1"
      },
      {
        "call_id": "c3",
        "api": "fridge.close",
        "args": {},
        "source_step_id": "s1"
      },
      {
        "call_id": "c4",
        "api": "robot.place",
        "args": {
          "item": "sample_tube",
          "to_location": "bench"
        },
        "source_step_id": "s2"
      },
      {
        "call_id": "c5",
        "api": "pipette.attach_tip",
        "args": {},
        "source_step_id": "s3"
      },
      {
        "call_id": "c6",
        "api": "pipette.transfer",
        "args": {
          "source": "lysis_buffer",
          "target": "sample_tube",
          "volume_ul": 50
        },
        "source_step_id": "s3"
      },
      {
        "call_id": "c7",
        "api": "pipette.discard_tip",
        "args": {},
        "source_step_id": "s3"
      },
      {
        "call_id": "c8",
        "api": "tube.cap",
        "args": {
          "tube_id": "sample_tube"
        },
        "source_step_id": "s4"
      },
      {
        "call_id": "c9",
        "api": "incubator.incubate",
        "args": {
          "tube_id": "sample_tube",
          "temperature_c": 37,
          "duration_min": 10
        },
        "source_step_id": "s5"
      },
      {
        "call_id": "c10",
        "api": "robot.pick",
        "args": {
          "item": "sample_tube",
          "from_location": "bench"
        },
        "source_step_id": "s6"
      },
      {
        "call_id": "c11",
        "api": "fridge.open",
        "args": {},
        "source_step_id": "s6"
      },
      {
        "call_id": "c12",
        "api": "robot.place",
        "args": {
          "item": "sample_tube",
          "to_location": "fridge"
        },
        "source_step_id": "s6"
      },
      {
        "call_id": "c13",
        "api": "fridge.close",
        "args": {},
        "source_step_id": "s6"
      }
    ]
  },
  "contains_unregistered_api": true,
  "unregistered_apis": [
    "incubator.incubate"
  ],
  "assumptions": [
    "The sample tube is identified as 'sample_tube' in the lab state, and lysis buffer is 'lysis_buffer'. The bench location is represented as 'bench'. The incubation step requires an incubator API, which is not registered, so 'incubator.incubate' is used as a placeholder with parameters for tube, temperature, and duration. The lab state after the workflow should match the expected state, with the tube back in the fridge and fridge closed."
  ]
}