{
  "decision": "The protocol step requires adding 100 uL buffer to the sample tube. The sample tube is initially in the fridge, capped, and the buffer is also in the fridge. To perform the transfer, we need to: open the fridge, pick the sample tube and buffer, uncap the sample tube, attach a pipette tip, transfer 100 uL from buffer to sample tube, discard the tip, cap the sample tube, place both items back in the fridge, and close the fridge. All required APIs are available in available_apis. The initial and expected lab states are identical, so after completing the transfer, we must restore the lab to the expected state (fridge closed, items in fridge, pipette no tip). The workflow includes steps to return items to fridge and close fridge, matching expected state.",
  "reasoning_summary": "The protocol step is a simple liquid transfer. We use available APIs to simulate the process: fridge.open to access items, robot.pick to handle tubes, tube.uncap to prepare sample tube, pipette.attach_tip and pipette.transfer for the transfer, then cleanup with pipette.discard_tip, tube.cap, robot.place to return items, and fridge.close. All APIs are registered, so contains_unregistered_api is false. The workflow ensures the lab ends in the expected state (fridge closed, items in fridge, pipette no tip).",
  "workflow": {
    "api_calls": [
      {
        "call_id": "c1",
        "api": "fridge.open",
        "args": {},
        "source_step_id": "s1"
      },
      {
        "call_id": "c2",
        "api": "robot.pick",
        "args": {
          "item": "sample_tube",
          "from_location": "fridge"
        },
        "source_step_id": "s1"
      },
      {
        "call_id": "c3",
        "api": "robot.pick",
        "args": {
          "item": "buffer",
          "from_location": "fridge"
        },
        "source_step_id": "s1"
      },
      {
        "call_id": "c4",
        "api": "tube.uncap",
        "args": {
          "tube_id": "sample_tube"
        },
        "source_step_id": "s1"
      },
      {
        "call_id": "c5",
        "api": "pipette.attach_tip",
        "args": {},
        "source_step_id": "s1"
      },
      {
        "call_id": "c6",
        "api": "pipette.transfer",
        "args": {
          "source": "buffer",
          "target": "sample_tube",
          "volume_ul": 100
        },
        "source_step_id": "s1"
      },
      {
        "call_id": "c7",
        "api": "pipette.discard_tip",
        "args": {},
        "source_step_id": "s1"
      },
      {
        "call_id": "c8",
        "api": "tube.cap",
        "args": {
          "tube_id": "sample_tube"
        },
        "source_step_id": "s1"
      },
      {
        "call_id": "c9",
        "api": "robot.place",
        "args": {
          "item": "sample_tube",
          "to_location": "fridge"
        },
        "source_step_id": "s1"
      },
      {
        "call_id": "c10",
        "api": "robot.place",
        "args": {
          "item": "buffer",
          "to_location": "fridge"
        },
        "source_step_id": "s1"
      },
      {
        "call_id": "c11",
        "api": "fridge.close",
        "args": {},
        "source_step_id": "s1"
      }
    ]
  },
  "contains_unregistered_api": false,
  "unregistered_apis": [],
  "assumptions": [
    "The 'sample tube' in the protocol corresponds to 'sample_tube' in lab_state_initial.",
    "The 'buffer' in the protocol corresponds to 'buffer' in lab_state_initial.",
    "The robot.pick and robot.place APIs can handle both tubes and reagents like buffer.",
    "The pipette.transfer API can transfer from a reagent container (buffer) to a tube (sample_tube).",
    "After transfer, the buffer volume decreases by 100 uL (from 10000 to 9900), but this is consistent with expected state as volume isn't specified in expected state—assuming it's acceptable."
  ]
}