{
  "decision": "Convert parsed protocol steps to API workflow calls using available_apis, ensuring lab state returns to expected state.",
  "reasoning_summary": "The protocol involves retrieving a sample tube from the fridge, adding buffer and mixing, then incubating. Available APIs support these actions via robot operations, pipetting, mixing, and heater control. After incubation, the tube must be returned to the fridge to match the expected lab state where sample_tube is in fridge and capped. All APIs used are registered in available_apis.",
  "workflow": {
    "api_calls": [
      {
        "call_id": "c1",
        "api": "fridge.open",
        "args": {},
        "source_step_id": "s1"
      },
      {
        "call_id": "c2",
        "api": "robot.pick",
        "args": {
          "item": "sample_tube",
          "from_location": "fridge"
        },
        "source_step_id": "s1"
      },
      {
        "call_id": "c3",
        "api": "fridge.close",
        "args": {},
        "source_step_id": "s1"
      },
      {
        "call_id": "c4",
        "api": "robot.place",
        "args": {
          "item": "sample_tube",
          "to_location": "bench"
        },
        "source_step_id": "s1"
      },
      {
        "call_id": "c5",
        "api": "tube.uncap",
        "args": {
          "tube_id": "sample_tube"
        },
        "source_step_id": "s2"
      },
      {
        "call_id": "c6",
        "api": "pipette.attach_tip",
        "args": {},
        "source_step_id": "s2"
      },
      {
        "call_id": "c7",
        "api": "pipette.transfer",
        "args": {
          "source": "buffer",
          "target": "sample_tube",
          "volume_ul": 100
        },
        "source_step_id": "s2"
      },
      {
        "call_id": "c8",
        "api": "pipette.mix",
        "args": {
          "container": "sample_tube",
          "volume_ul": 100,
          "times": 5
        },
        "source_step_id": "s2"
      },
      {
        "call_id": "c9",
        "api": "pipette.discard_tip",
        "args": {},
        "source_step_id": "s2"
      },
      {
        "call_id": "c10",
        "api": "tube.cap",
        "args": {
          "tube_id": "sample_tube"
        },
        "source_step_id": "s2"
      },
      {
        "call_id": "c11",
        "api": "heater.set_temperature",
        "args": {
          "temperature_c": 37
        },
        "source_step_id": "s3"
      },
      {
        "call_id": "c12",
        "api": "heater.place",
        "args": {
          "item": "sample_tube"
        },
        "source_step_id": "s3"
      },
      {
        "call_id": "c13",
        "api": "timer.wait",
        "args": {
          "minutes": 10
        },
        "source_step_id": "s3"
      },
      {
        "call_id": "c14",
        "api": "heater.remove",
        "args": {
          "item": "sample_tube"
        },
        "source_step_id": "s3"
      },
      {
        "call_id": "c15",
        "api": "fridge.open",
        "args": {},
        "source_step_id": null
      },
      {
        "call_id": "c16",
        "api": "robot.pick",
        "args": {
          "item": "sample_tube",
          "from_location": "bench"
        },
        "source_step_id": null
      },
      {
        "call_id": "c17",
        "api": "robot.place",
        "args": {
          "item": "sample_tube",
          "to_location": "fridge"
        },
        "source_step_id": null
      },
      {
        "call_id": "c18",
        "api": "fridge.close",
        "args": {},
        "source_step_id": null
      }
    ]
  },
  "contains_unregistered_api": false,
  "unregistered_apis": [],
  "assumptions": [
    "Buffer is in fridge as per lab_state_initial, and robot operations handle tube movement between fridge and bench. After incubation, tube is returned to fridge to match expected state where sample_tube location is fridge and is_capped true."
  ]
}