{
  "decision": "Proceed with workflow generation, but note that centrifuge step requires an unregistered API.",
  "reasoning_summary": "The protocol has three steps: take sample tube from fridge, briefly centrifuge it, then add buffer and incubate. The 'take' step can be implemented using available APIs: open fridge, pick tube, close fridge. The 'centrifuge' step has no matching API in available_apis (no centrifuge-related APIs), so it must be marked as unregistered. The 'add_and_incubate' step can be partially implemented: we can uncap tube, attach tip, transfer buffer, discard tip, set heater temperature, place tube, wait, remove tube, and cap tube. However, the expected lab state requires the sample tube to be back in the fridge and capped, and all items returned to initial locations. After completing the incubate step, we need to return the tube to the fridge. Since the initial and expected lab states are identical, we must ensure the lab is restored to that state. The centrifuge step is unregistered, so we'll create a placeholder call for it and set contains_unregistered_api=true.",
  "workflow": {
    "api_calls": [
      {
        "call_id": "c1",
        "api": "fridge.open",
        "args": {},
        "source_step_id": "s1"
      },
      {
        "call_id": "c2",
        "api": "robot.pick",
        "args": {
          "item": "sample_tube",
          "from_location": "fridge"
        },
        "source_step_id": "s1"
      },
      {
        "call_id": "c3",
        "api": "fridge.close",
        "args": {},
        "source_step_id": "s1"
      },
      {
        "call_id": "c4",
        "api": "centrifuge.brief_spin",
        "args": {
          "tube_id": "sample_tube"
        },
        "source_step_id": "s2"
      },
      {
        "call_id": "c5",
        "api": "tube.uncap",
        "args": {
          "tube_id": "sample_tube"
        },
        "source_step_id": "s3"
      },
      {
        "call_id": "c6",
        "api": "pipette.attach_tip",
        "args": {},
        "source_step_id": "s3"
      },
      {
        "call_id": "c7",
        "api": "pipette.transfer",
        "args": {
          "source": "buffer",
          "target": "sample_tube",
          "volume_ul": 100
        },
        "source_step_id": "s3"
      },
      {
        "call_id": "c8",
        "api": "pipette.discard_tip",
        "args": {},
        "source_step_id": "s3"
      },
      {
        "call_id": "c9",
        "api": "heater.set_temperature",
        "args": {
          "temperature_c": 37
        },
        "source_step_id": "s3"
      },
      {
        "call_id": "c10",
        "api": "heater.place",
        "args": {
          "item": "sample_tube"
        },
        "source_step_id": "s3"
      },
      {
        "call_id": "c11",
        "api": "timer.wait",
        "args": {
          "minutes": 10
        },
        "source_step_id": "s3"
      },
      {
        "call_id": "c12",
        "api": "heater.remove",
        "args": {
          "item": "sample_tube"
        },
        "source_step_id": "s3"
      },
      {
        "call_id": "c13",
        "api": "tube.cap",
        "args": {
          "tube_id": "sample_tube"
        },
        "source_step_id": "s3"
      },
      {
        "call_id": "c14",
        "api": "fridge.open",
        "args": {},
        "source_step_id": "s1"
      },
      {
        "call_id": "c15",
        "api": "robot.place",
        "args": {
          "item": "sample_tube",
          "to_location": "fridge"
        },
        "source_step_id": "s1"
      },
      {
        "call_id": "c16",
        "api": "fridge.close",
        "args": {},
        "source_step_id": "s1"
      }
    ]
  },
  "contains_unregistered_api": true,
  "unregistered_apis": [
    "centrifuge.brief_spin"
  ],
  "assumptions": [
    "The sample tube is identified as 'sample_tube'. The buffer reagent is identified as 'buffer'. The centrifuge step is a brief spin, so we create a placeholder API 'centrifuge.brief_spin' with tube_id parameter. After incubation, we return the tube to the fridge to match expected lab state."
  ]
}